{
  "$schema": "https://json-schema.org/draft/2020-12/schema",
  "$id": "https://rota-saude/schemas/clinical/clinical-document-v1.json",
  "title": "rotasaude.clinical_document.v1",
  "description": "JSON canônico do documento clínico emitido na consulta (ADR 0033; módulo 19c): atestado, declaração de comparecimento, receita (comum; de controle especial e de antimicrobiano com número SNCR desde clinical-v1.2.0, ADR 0034) e requisição de exames. É o conteúdo assinado em CAdES destacado AD-RB, serializado em RFC 8785 (JCS), quando o documento sai em modo digital; o PAdES vai sobre o PDF. Mesmo cabeçalho e mesmas convenções de consultation-v1.json (UTC com segundos e 'Z', CPF/CNES/IBGE/CBO só dígitos, texto vazio null, inteiros onde for código). O conteúdo é escolhido por document.kind. Fechado (additionalProperties: false) porque o que não está no esquema não pode entrar no que se assina.",
  "type": "object",
  "additionalProperties": false,
  "required": ["schema", "city", "unit", "professional", "patient", "document", "content"],
  "properties": {
    "schema": { "const": "rotasaude.clinical_document.v1" },
    "city": { "$ref": "#/$defs/city" },
    "unit": { "$ref": "#/$defs/unit" },
    "professional": { "$ref": "#/$defs/professional" },
    "patient": { "$ref": "#/$defs/patient" },
    "document": {
      "type": "object",
      "additionalProperties": false,
      "required": ["id", "kind", "issued_at", "replaces_document_id"],
      "properties": {
        "id": { "$ref": "#/$defs/uuid" },
        "kind": { "enum": ["sick_note", "attendance_declaration", "prescription", "exam_requisition"] },
        "issued_at": { "$ref": "#/$defs/utc_datetime" },
        "replaces_document_id": { "anyOf": [{ "$ref": "#/$defs/uuid" }, { "type": "null" }], "description": "O documento cancelado que este substitui (\"cancelar e emitir outro\"); null quando não substitui nenhum." }
      }
    },
    "content": { "type": "object" }
  },
  "allOf": [
    {
      "if": { "required": ["document"], "properties": { "document": { "required": ["kind"], "properties": { "kind": { "const": "sick_note" } } } } },
      "then": { "properties": { "content": { "$ref": "#/$defs/sick_note" } } }
    },
    {
      "if": { "required": ["document"], "properties": { "document": { "required": ["kind"], "properties": { "kind": { "const": "attendance_declaration" } } } } },
      "then": { "properties": { "content": { "$ref": "#/$defs/attendance_declaration" } } }
    },
    {
      "if": { "required": ["document"], "properties": { "document": { "required": ["kind"], "properties": { "kind": { "const": "prescription" } } } } },
      "then": { "properties": { "content": { "$ref": "#/$defs/prescription" } } }
    },
    {
      "if": { "required": ["document"], "properties": { "document": { "required": ["kind"], "properties": { "kind": { "const": "exam_requisition" } } } } },
      "then": { "properties": { "content": { "$ref": "#/$defs/exam_requisition" } } }
    }
  ],
  "$defs": {
    "uuid": { "type": "string", "pattern": "^[0-9a-f]{8}-[0-9a-f]{4}-[0-9a-f]{4}-[0-9a-f]{4}-[0-9a-f]{12}$" },
    "utc_datetime": { "type": "string", "pattern": "^[0-9]{4}-[0-9]{2}-[0-9]{2}T[0-9]{2}:[0-9]{2}:[0-9]{2}Z$", "description": "ISO 8601 em UTC, com segundos, sem fração, com 'Z'." },
    "date": { "type": "string", "pattern": "^[0-9]{4}-[0-9]{2}-[0-9]{2}$" },
    "cpf": { "type": "string", "pattern": "^[0-9]{11}$", "description": "Só dígitos, sem máscara." },
    "clinical_text": { "type": ["string", "null"], "minLength": 1, "maxLength": 20000, "description": "null quando o campo ficou vazio; nunca string vazia." },
    "city": {
      "type": "object",
      "additionalProperties": false,
      "required": ["ibge_code", "name"],
      "properties": {
        "ibge_code": { "type": ["string", "null"], "pattern": "^[0-9]{7}$" },
        "name": { "type": "string", "minLength": 1 }
      }
    },
    "unit": {
      "type": "object",
      "additionalProperties": false,
      "required": ["cnes", "name"],
      "properties": {
        "cnes": { "type": ["string", "null"], "pattern": "^[0-9]{7}$" },
        "name": { "type": "string", "minLength": 1 }
      }
    },
    "professional": {
      "type": "object",
      "additionalProperties": false,
      "required": ["name", "cpf", "cbo_code", "council"],
      "properties": {
        "name": { "type": "string", "minLength": 1 },
        "cpf": { "$ref": "#/$defs/cpf" },
        "cbo_code": { "type": "string", "pattern": "^[0-9]{6}$" },
        "council": {
          "type": "object",
          "additionalProperties": false,
          "required": ["name", "state", "registration_number"],
          "properties": {
            "name": { "enum": ["CRM", "COREN", "CRO", "CRF", "CRP", "CREFITO", "CRN", "CRFa", "CRESS", "CRBM", "CREF", "CRMV"] },
            "state": { "type": "string", "pattern": "^[A-Z]{2}$" },
            "registration_number": { "type": "string", "pattern": "^[0-9]{1,10}$" }
          }
        }
      }
    },
    "patient": {
      "type": "object",
      "additionalProperties": false,
      "required": ["display_name", "cpf", "birth_date"],
      "properties": {
        "display_name": { "type": "string", "minLength": 1, "maxLength": 200 },
        "cpf": { "$ref": "#/$defs/cpf" },
        "birth_date": { "anyOf": [{ "$ref": "#/$defs/date" }, { "type": "null" }] }
      }
    },
    "exam_requests": {
      "type": "array",
      "maxItems": 100,
      "items": {
        "type": "object",
        "additionalProperties": false,
        "required": ["sigtap_code", "competence", "label"],
        "properties": {
          "sigtap_code": { "type": "string", "pattern": "^02[0-9]{8}$" },
          "competence": { "type": "string", "pattern": "^[0-9]{4}(0[1-9]|1[0-2])$", "description": "Competência SIGTAP (AAAAMM) da tabela de onde saiu o rótulo, vigente no ato." },
          "label": { "type": "string", "minLength": 1 },
          "cid10_justification": { "type": "string", "minLength": 1, "maxLength": 8 }
        }
      }
    },
    "local_time": { "type": "string", "pattern": "^([01][0-9]|2[0-3]):[0-5][0-9]$", "description": "Hora de parede da cidade (HH:MM, 24 h), no dia de `date`." },
    "person_name": { "type": "string", "minLength": 1, "maxLength": 200 },
    "sick_note": {
      "type": "object",
      "additionalProperties": false,
      "description": "Atestado. leave = afastamento (dias e início); companion = acompanhante (nome, parentesco e motivo da CLT art. 473), nunca com CID. CID só com cid_authorized: true (autorização do paciente registrada).",
      "required": ["type", "cid_authorized", "note"],
      "properties": {
        "type": { "enum": ["leave", "companion"] },
        "days": { "type": "integer", "minimum": 1 },
        "start_on": { "$ref": "#/$defs/date" },
        "companion_name": { "$ref": "#/$defs/person_name" },
        "companion_kinship": { "type": "string", "minLength": 1 },
        "companion_reason": { "enum": ["clt_473_x", "clt_473_xi", "clt_473_xii", "other"] },
        "cid10": {
          "type": "object",
          "additionalProperties": false,
          "required": ["code", "label"],
          "properties": {
            "code": { "type": "string", "minLength": 1, "maxLength": 8 },
            "label": { "type": "string", "minLength": 1 }
          }
        },
        "cid_authorized": { "type": "boolean" },
        "note": { "$ref": "#/$defs/clinical_text" }
      },
      "allOf": [
        {
          "if": { "properties": { "type": { "const": "leave" } } },
          "then": {
            "required": ["days", "start_on"],
            "properties": { "companion_name": false, "companion_kinship": false, "companion_reason": false }
          }
        },
        {
          "if": { "properties": { "type": { "const": "companion" } } },
          "then": {
            "required": ["companion_name", "companion_kinship", "companion_reason"],
            "properties": { "cid10": false, "days": false }
          }
        },
        {
          "if": { "required": ["cid10"] },
          "then": { "properties": { "cid_authorized": { "const": true } } }
        }
      ]
    },
    "attendance_declaration": {
      "type": "object",
      "additionalProperties": false,
      "description": "Declaração de comparecimento: o dia e o período (manhã, tarde, dia todo) OU a hora de chegada (e a de saída, se houver), nunca os dois.",
      "required": ["date", "unit_name"],
      "properties": {
        "date": { "$ref": "#/$defs/date" },
        "arrived_at": { "$ref": "#/$defs/local_time" },
        "left_at": { "$ref": "#/$defs/local_time" },
        "period": { "enum": ["morning", "afternoon", "full_day"] },
        "unit_name": { "type": "string", "minLength": 1 },
        "companion_name": { "$ref": "#/$defs/person_name" },
        "issuer_registration": { "type": "string", "minLength": 1 }
      },
      "if": { "required": ["period"] },
      "then": { "properties": { "arrived_at": false, "left_at": false } },
      "else": { "required": ["arrived_at"] }
    },
    "catalog_item": {
      "type": "object",
      "additionalProperties": false,
      "required": ["id", "catmat_code", "label", "active_ingredient", "strength", "dosage_form"],
      "properties": {
        "id": { "$ref": "#/$defs/uuid" },
        "catmat_code": { "type": "integer", "minimum": 1, "description": "Código do item no CATMAT (codigoItem do Compras.gov), inteiro." },
        "label": { "type": "string", "minLength": 1 },
        "active_ingredient": { "type": "string", "minLength": 1, "description": "Denominação Comum Brasileira (DCB)." },
        "strength": { "type": "string", "minLength": 1 },
        "dosage_form": { "type": ["string", "null"], "minLength": 1, "description": "Forma farmacêutica; null quando o CATMAT não traz (decisão do usuário, 2026-10-10)." }
      }
    },
    "prescription_item": {
      "type": "object",
      "additionalProperties": false,
      "description": "Item do catálogo OU texto livre, nunca os dois.",
      "required": ["position", "printed_description", "quantity", "quantity_unit", "route", "dosage_instructions", "continuous", "antimicrobial"],
      "properties": {
        "position": { "type": "integer", "minimum": 1 },
        "catalog_item": { "$ref": "#/$defs/catalog_item" },
        "free_text": { "type": "string", "minLength": 1 },
        "printed_description": { "type": "string", "minLength": 1 },
        "quantity": { "type": "number", "exclusiveMinimum": 0, "description": "Quantidade na unidade de quantity_unit; pode ter até 2 casas decimais (o JCS escreve a forma mais curta)." },
        "quantity_unit": { "type": "string", "minLength": 1 },
        "route": { "enum": ["oral", "sublingual", "topical", "ophthalmic", "otic", "nasal", "inhalation", "vaginal", "rectal", "intramuscular", "intravenous", "subcutaneous", "other"] },
        "dosage_instructions": { "type": "string", "minLength": 1 },
        "duration_days": { "type": "integer", "minimum": 1 },
        "continuous": { "type": "boolean" },
        "antimicrobial": { "type": "boolean" },
        "reason_problem_id": { "$ref": "#/$defs/uuid" }
      },
      "if": { "required": ["catalog_item"] },
      "then": { "properties": { "free_text": false } },
      "else": { "required": ["free_text"] }
    },
    "prescription": {
      "type": "object",
      "additionalProperties": false,
      "description": "Receita. catalog_release é a versão do catálogo de medicamentos vigente na emissão (null quando todos os itens são texto livre). Receita de enfermagem (nursing_protocol) leva o CNPJ da cidade e só itens do catálogo. Antimicrobiano ou controle especial: 2 vias e validade; senão 1 via. Desde clinical-v1.2.0 (ADR 0034): category, calculada pelos itens, só na receita de controle especial (special_control, listas C1/C5: número SNCR rce, identificação do paciente, contato do prescritor, 2 vias e validade) e na de antimicrobiano digital (antimicrobial: número SNCR ret e contato do prescritor). Sem category = receita comum, antes ou depois do 19d (forma da clinical-v1.1.0, uma só representação).",
      "required": ["items", "catalog_release", "antimicrobial", "copies"],
      "properties": {
        "items": { "type": "array", "minItems": 1, "items": { "$ref": "#/$defs/prescription_item" } },
        "catalog_release": { "type": ["string", "null"], "minLength": 1 },
        "nursing_protocol": {
          "type": "object",
          "additionalProperties": false,
          "required": ["id", "title", "number", "year", "version_id"],
          "properties": {
            "id": { "$ref": "#/$defs/uuid" },
            "title": { "type": "string", "minLength": 1 },
            "number": { "type": "string", "minLength": 1 },
            "year": { "type": "integer", "minimum": 1900, "maximum": 2999 },
            "version_id": { "$ref": "#/$defs/uuid" }
          }
        },
        "city_cnpj": { "type": "string", "pattern": "^[0-9A-Z]{12}[0-9]{2}$", "description": "CNPJ sem máscara: 12 caracteres [0-9A-Z] e 2 dígitos verificadores (IN RFB 2.229/2024; o numérico é o caso particular)." },
        "antimicrobial": { "type": "boolean" },
        "copies": { "enum": [1, 2] },
        "valid_until": { "$ref": "#/$defs/date" },
        "category": { "enum": ["special_control", "antimicrobial"], "description": "Ausente na receita comum (o api não grava category: common no canônico)." },
        "sncr": { "$ref": "#/$defs/sncr" },
        "patient_identification": { "$ref": "#/$defs/patient_identification" },
        "prescriber_contact": { "$ref": "#/$defs/prescriber_contact" }
      },
      "allOf": [
        {
          "if": {
            "anyOf": [
              { "required": ["antimicrobial"], "properties": { "antimicrobial": { "const": true } } },
              { "required": ["category"], "properties": { "category": { "const": "special_control" } } }
            ]
          },
          "then": { "required": ["valid_until"], "properties": { "copies": { "const": 2 } } },
          "else": { "properties": { "copies": { "const": 1 } } }
        },
        {
          "if": { "required": ["nursing_protocol"] },
          "then": {
            "required": ["city_cnpj"],
            "properties": { "items": { "items": { "required": ["catalog_item"] } } }
          }
        },
        {
          "if": { "not": { "required": ["category"] } },
          "then": { "properties": { "sncr": false, "patient_identification": false, "prescriber_contact": false } }
        },
        {
          "if": { "required": ["category"], "properties": { "category": { "const": "special_control" } } },
          "then": {
            "required": ["sncr", "patient_identification", "prescriber_contact"],
            "properties": {
              "antimicrobial": { "const": false },
              "nursing_protocol": false,
              "sncr": { "properties": { "kind": { "const": "rce" } } },
              "items": { "items": { "required": ["catalog_item", "duration_days"], "properties": { "antimicrobial": { "const": false } } } }
            }
          }
        },
        {
          "if": { "required": ["category"], "properties": { "category": { "const": "antimicrobial" } } },
          "then": {
            "required": ["sncr", "prescriber_contact"],
            "properties": {
              "antimicrobial": { "const": true },
              "nursing_protocol": false,
              "sncr": { "properties": { "kind": { "const": "ret" } } },
              "items": { "items": { "properties": { "antimicrobial": { "const": true } } } }
            }
          }
        }
      ]
    },
    "address": {
      "type": "object",
      "additionalProperties": false,
      "description": "Endereço completo (Lei 5.991/1973, art. 35; RDC 1.000/2025): logradouro, número (texto; quando não há número, grafia fixa 's/n', minúsculas, com barra), complemento (ausente quando não há), bairro, cidade, UF e CEP só com dígitos.",
      "required": ["street", "number", "district", "city", "uf", "zip"],
      "properties": {
        "street": { "type": "string", "minLength": 1, "maxLength": 120 },
        "number": { "type": "string", "minLength": 1, "maxLength": 10 },
        "complement": { "type": "string", "minLength": 1, "maxLength": 60 },
        "district": { "type": "string", "minLength": 1, "maxLength": 80 },
        "city": { "type": "string", "minLength": 1, "maxLength": 80 },
        "uf": { "type": "string", "pattern": "^[A-Z]{2}$" },
        "zip": { "type": "string", "pattern": "^[0-9]{8}$" }
      }
    },
    "sncr": {
      "type": "object",
      "additionalProperties": false,
      "description": "Número do SNCR (Anvisa) consumido na emissão: rce na receita de controle especial, ret na de antimicrobiano. number no formato do SNCR AAMM.T-UF.NNNNNNN (ano e mês, tipo, código IBGE da UF, sequência; ex.: 2610.1-41.0001234). simulated: true quando veio do SNCR simulado (fora de produção, sem validade).",
      "required": ["kind", "number", "simulated"],
      "properties": {
        "kind": { "enum": ["rce", "ret"] },
        "number": { "type": "string", "pattern": "^[0-9]{4}\\.[0-9]-[0-9]{2}\\.[0-9]{7}$" },
        "simulated": { "type": "boolean" }
      }
    },
    "patient_identification": {
      "type": "object",
      "additionalProperties": false,
      "description": "Identificação do paciente na receita de controle especial (e, se o prescritor quiser, na de antimicrobiano): o CPF do cadastro do paciente (sempre existe, regra do 19a) e o endereço completo.",
      "required": ["cpf", "address"],
      "properties": {
        "cpf": { "$ref": "#/$defs/cpf" },
        "address": { "$ref": "#/$defs/address" }
      }
    },
    "prescriber_contact": {
      "type": "object",
      "additionalProperties": false,
      "description": "Endereço completo e telefone do prescritor (perfil do profissional), impressos na receita de controle especial e na de antimicrobiano.",
      "required": ["address", "phone"],
      "properties": {
        "address": { "$ref": "#/$defs/address" },
        "phone": { "type": "string", "pattern": "^[0-9]{10,11}$", "description": "DDD e número, só dígitos." }
      }
    },
    "exam_requisition": {
      "type": "object",
      "additionalProperties": false,
      "description": "Requisição de exames: os pedidos de exame da consulta (SIGTAP grupo 02, com a competência gravada no ato).",
      "required": ["exams", "note"],
      "properties": {
        "exams": { "$ref": "#/$defs/exam_requests", "minItems": 1 },
        "note": { "$ref": "#/$defs/clinical_text" }
      }
    }
  }
}
