{
  "schema": "rotasaude.clinical_document.v1",
  "city": {
    "ibge_code": "4106902",
    "name": "Curitiba"
  },
  "unit": {
    "cnes": "0015466",
    "name": "UBS Ouvidor Pardinho"
  },
  "professional": {
    "name": "Ana Beatriz Souza",
    "cpf": "52998224725",
    "cbo_code": "225142",
    "council": {
      "name": "CRM",
      "state": "PR",
      "registration_number": "45678"
    }
  },
  "patient": {
    "display_name": "Joana D'Arc Conceição 👩🏽‍⚕️",
    "cpf": "39053344705",
    "birth_date": "1961-03-14"
  },
  "document": {
    "id": "7c1e2a3b-4d5e-4f60-8a1b-2c3d4e5f6a75",
    "kind": "prescription",
    "issued_at": "2026-10-09T13:41:37Z",
    "replaces_document_id": null
  },
  "content": {
    "items": [
      {
        "position": 1,
        "catalog_item": {
          "id": "3f0e1d2c-3b4a-4596-8877-665544332211",
          "catmat_code": 267656,
          "label": "Metformina, cloridrato 850 mg, comprimido",
          "active_ingredient": "cloridrato de metformina",
          "strength": "850 mg",
          "dosage_form": "comprimido"
        },
        "printed_description": "Cloridrato de metformina 850 mg — comprimido",
        "quantity": 60,
        "quantity_unit": "comprimido",
        "route": "oral",
        "dosage_instructions": "Tomar 1 comprimido após o café e 1 após o jantar.",
        "duration_days": 30,
        "continuous": true,
        "antimicrobial": false,
        "reason_problem_id": "9a8b7c6d-5e4f-4a3b-9c2d-1e0f9a8b7c6d"
      },
      {
        "position": 2,
        "free_text": "Soro fisiológico 0,9% para lavagem nasal",
        "printed_description": "Soro fisiológico 0,9% para lavagem nasal",
        "quantity": 1.5,
        "quantity_unit": "frasco",
        "route": "nasal",
        "dosage_instructions": "Aplicar 2 jatos em cada narina 3 vezes ao dia.",
        "continuous": false,
        "antimicrobial": false
      }
    ],
    "catalog_release": "2026-10-09",
    "antimicrobial": false,
    "copies": 1
  }
}
