{
  "schema": "rotasaude.clinical_document.v1",
  "city": {
    "ibge_code": "4106902",
    "name": "Curitiba"
  },
  "unit": {
    "cnes": "0015466",
    "name": "UBS Ouvidor Pardinho"
  },
  "professional": {
    "name": "Ana Beatriz Souza",
    "cpf": "52998224725",
    "cbo_code": "225142",
    "council": {
      "name": "CRM",
      "state": "PR",
      "registration_number": "45678"
    }
  },
  "patient": {
    "display_name": "Joana D'Arc Conceição 👩🏽‍⚕️",
    "cpf": "39053344705",
    "birth_date": "1961-03-14"
  },
  "document": {
    "id": "7c1e2a3b-4d5e-4f60-8a1b-2c3d4e5f6a79",
    "kind": "prescription",
    "issued_at": "2026-10-09T13:41:37Z",
    "replaces_document_id": null
  },
  "content": {
    "items": [
      {
        "position": 1,
        "catalog_item": {
          "id": "3f0e1d2c-3b4a-4596-8877-665544332214",
          "catmat_code": 267503,
          "label": "Sertralina, cloridrato 50 mg, comprimido",
          "active_ingredient": "cloridrato de sertralina",
          "strength": "50 mg",
          "dosage_form": "comprimido"
        },
        "printed_description": "Cloridrato de sertralina 50 mg — comprimido",
        "quantity": 60,
        "quantity_unit": "comprimido",
        "route": "oral",
        "dosage_instructions": "Tomar 1 comprimido pela manhã.",
        "duration_days": 60,
        "continuous": true,
        "antimicrobial": false
      }
    ],
    "catalog_release": "2026-10-09",
    "antimicrobial": false,
    "copies": 2,
    "valid_until": "2026-11-08",
    "category": "special_control",
    "sncr": {
      "kind": "rce",
      "number": "2610.1-41.0001234",
      "simulated": true
    },
    "patient_identification": {
      "cpf": "39053344705",
      "address": {
        "street": "Rua Marechal Deodoro",
        "number": "630",
        "complement": "apto 12",
        "district": "Centro",
        "city": "Curitiba",
        "uf": "PR",
        "zip": "80010010"
      }
    },
    "prescriber_contact": {
      "address": {
        "street": "Rua Ouvidor Pardinho",
        "number": "28",
        "district": "Rebouças",
        "city": "Curitiba",
        "uf": "PR",
        "zip": "80230040"
      },
      "phone": "4133501234"
    }
  }
}
