{
  "schema": "rotasaude.clinical_document.v1",
  "city": {
    "ibge_code": "4106902",
    "name": "Curitiba"
  },
  "unit": {
    "cnes": "0015466",
    "name": "UBS Ouvidor Pardinho"
  },
  "professional": {
    "name": "Ana Beatriz Souza",
    "cpf": "52998224725",
    "cbo_code": "225142",
    "council": {
      "name": "CRM",
      "state": "PR",
      "registration_number": "45678"
    }
  },
  "patient": {
    "display_name": "Joana D'Arc Conceição 👩🏽‍⚕️",
    "cpf": "39053344705",
    "birth_date": "1961-03-14"
  },
  "document": {
    "id": "7c1e2a3b-4d5e-4f60-8a1b-2c3d4e5f6a72",
    "kind": "sick_note",
    "issued_at": "2026-10-09T13:41:37Z",
    "replaces_document_id": "7c1e2a3b-4d5e-4f60-8a1b-2c3d4e5f6a70"
  },
  "content": {
    "type": "companion",
    "start_on": "2026-10-09",
    "companion_name": "Marcos Conceição",
    "companion_kinship": "filho",
    "companion_reason": "clt_473_xi",
    "cid_authorized": false,
    "note": "Acompanhou o filho de 4 anos na consulta."
  }
}
