{
  "schema": "rotasaude.clinical_document.v1",
  "city": {
    "ibge_code": "4106902",
    "name": "Curitiba"
  },
  "unit": {
    "cnes": "0015466",
    "name": "UBS Ouvidor Pardinho"
  },
  "professional": {
    "name": "Ana Beatriz Souza",
    "cpf": "52998224725",
    "cbo_code": "225142",
    "council": {
      "name": "CRM",
      "state": "PR",
      "registration_number": "45678"
    }
  },
  "patient": {
    "display_name": "Joana D'Arc Conceição 👩🏽‍⚕️",
    "cpf": "39053344705",
    "birth_date": "1961-03-14"
  },
  "document": {
    "id": "7c1e2a3b-4d5e-4f60-8a1b-2c3d4e5f6a77",
    "kind": "prescription",
    "issued_at": "2026-10-09T13:41:37Z",
    "replaces_document_id": null
  },
  "content": {
    "items": [
      {
        "position": 1,
        "catalog_item": {
          "id": "3f0e1d2c-3b4a-4596-8877-665544332213",
          "catmat_code": 267621,
          "label": "Amoxicilina 500 mg, cápsula",
          "active_ingredient": "amoxicilina",
          "strength": "500 mg",
          "dosage_form": "cápsula"
        },
        "printed_description": "Amoxicilina 500 mg — cápsula",
        "quantity": 21,
        "quantity_unit": "cápsula",
        "route": "oral",
        "dosage_instructions": "Tomar 1 cápsula de 8 em 8 horas por 7 dias.",
        "duration_days": 7,
        "continuous": false,
        "antimicrobial": true
      }
    ],
    "catalog_release": "2026-10-09",
    "antimicrobial": true,
    "copies": 2,
    "valid_until": "2026-10-19"
  }
}
