{
  "schema": "rotasaude.clinical_document.v1",
  "city": {
    "ibge_code": "4106902",
    "name": "Curitiba"
  },
  "unit": {
    "cnes": "0015466",
    "name": "UBS Ouvidor Pardinho"
  },
  "professional": {
    "name": "Ana Beatriz Souza",
    "cpf": "52998224725",
    "cbo_code": "225142",
    "council": {
      "name": "CRM",
      "state": "PR",
      "registration_number": "45678"
    }
  },
  "patient": {
    "display_name": "Joana D'Arc Conceição 👩🏽‍⚕️",
    "cpf": "39053344705",
    "birth_date": "1961-03-14"
  },
  "document": {
    "id": "7c1e2a3b-4d5e-4f60-8a1b-2c3d4e5f6a79",
    "kind": "prescription",
    "issued_at": "2026-10-09T13:41:37Z",
    "replaces_document_id": null
  },
  "content": {
    "items": [
      {
        "position": 1,
        "catalog_item": {
          "id": "3f0e1d2c-3b4a-4596-8877-665544332214",
          "catmat_code": 268856,
          "label": "Losartana potássica 50 mg",
          "active_ingredient": "losartana potássica",
          "strength": "50 mg",
          "dosage_form": null
        },
        "printed_description": "LOSARTANA POTÁSSICA 50 MG",
        "quantity": 30,
        "quantity_unit": "comprimido",
        "route": "oral",
        "dosage_instructions": "Tomar 1 comprimido pela manhã.",
        "duration_days": 30,
        "continuous": true,
        "antimicrobial": false
      }
    ],
    "catalog_release": "8d2c4b6a-1f3e-4a5b-9c7d-0e1f2a3b4c5d",
    "antimicrobial": false,
    "copies": 1
  }
}
